<?xml version="1.0" encoding="UTF-8"?>
<!DOCTYPE module SYSTEM "module.dtd" >
<module>
    <name>mail</name>
    <class>info.magnolia.cms.mail.Engine</class>
    <version>3.0</version>
    <displayName>Magnolia templating mail</displayName>
    <servlets>
        <servlet>
            <class>info.magnolia.cms.mail.servlets.MgnlMailServlet</class>
            <mappings>
                <mapping>/Mail</mapping>
            </mappings>
            <name>Mail</name>
            <comment>Servlet to send email using the email system.</comment>
            <params>
                <!--              <param></param> -->
            </params>
        </servlet>
    </servlets>
</module>
